<?xml version="1.0" encoding="UTF-8"?>
<!DOCTYPE table PUBLIC "-//openMarinkaRodeo.org//DTD DBSchema V1.1//EN" 
  "https://openMarinkaRodeo.org/pub/openMarinkaRodeo/dbschema/dtd/1.1/dbschema.dtd" [

<!ENTITY % entities SYSTEM "entities.xml">
%entities;

]>

<table id="jwt_secrets" xmlns:db="http://docbook.org/ns/docbook">
	<name>jwt_secrets</name>
	<version>1</version>
	<type db="mysql">&MYSQL_TABLE_TYPE;</type>
	<description>
		<db:para>This table is used by the AUTH_JWT module to read the actual JWT secrets which are used for authentication
		More information can be found at: &OPENMarinkaRodeo_MOD_DOC;auth_jwt.html.
		</db:para>
	</description>

	<column id="id">
		<name>id</name>
		<type>unsigned int</type>
		<size>&table_id_len;</size>
		<autoincrement/>
		<natural/>
		<primary/>
		<type db="dbtext">int,auto</type>
		<description>Table key, not used by module</description>
	</column>

	<column id="corresponding_tag">
		<name>corresponding_tag</name>
		<type>string</type>
		<size>128</size>
		<description>JWT profile tag which this secret belongs to</description>
	</column>

	<column id="secret">
		<name>secret</name>
		<type>text</type>
		<description>The KEY used for signing the JWT
		</description>
	</column>

	<column id="start_ts">
		<name>start_ts</name>
		<type>int</type>
		<description>UNIX TS for the START period on which the JWT secret is valid
		</description>
	</column>

	<column id="end_ts">
		<name>end_ts</name>
		<type>int</type>
		<description>UNIX TS for the END period on which the JWT secret is valid
		</description>
	</column>

</table>
